{
  "$schema": "https://json-schema.org/draft/2020-12/schema",
  "$id": "https://jungial.local/schemas/gni_processing_request.schema.json",
  "title": "GniProcessingRequestV1",
  "type": "object",
  "required": [
    "schema",
    "schemaVersion",
    "provider",
    "endpoint",
    "model",
    "contract",
    "payload"
  ],
  "properties": {
    "schema": { "const": "GniProcessingRequestV1" },
    "schemaVersion": { "const": 1 },
    "provider": { "const": "GNI" },
    "endpoint": { "type": "string" },
    "model": { "type": "string" },
    "contract": {
      "type": "object",
      "required": ["inputFormat", "outputFormat", "allowedDirectives"],
      "properties": {
        "inputFormat": { "const": "SessionBundleV1" },
        "outputFormat": { "const": "JungialDirectiveV1" },
        "allowedDirectives": {
          "type": "array",
          "items": { "type": "string" }
        }
      },
      "additionalProperties": false
    },
    "payload": {
      "type": "object",
      "required": [
        "schema",
        "schemaVersion",
        "sessionId",
        "dominantArchetype",
        "vibeState",
        "coherence",
        "recentSymbols",
        "recentActions",
        "roomConfigSnapshot",
        "selectedDream",
        "archetypeVector"
      ],
      "properties": {
        "schema": { "const": "SessionBundleV1" },
        "schemaVersion": { "const": 1 },
        "sessionId": { "type": "string" },
        "dominantArchetype": { "type": "string" },
        "vibeState": { "type": "string" },
        "coherence": { "type": "number", "minimum": 0, "maximum": 1 },
        "recentSymbols": { "type": "array", "items": { "type": "string" } },
        "recentActions": { "type": "array", "items": { "type": "string" } },
        "roomConfigSnapshot": { "type": ["object", "null"] },
        "selectedDream": { "type": ["object", "null"] },
        "archetypeVector": {
          "type": "object",
          "additionalProperties": { "type": "number" }
        },
        "dreamJourneyContext": { "$ref": "#/$defs/dreamJourneyContext" },
        "dreamerMemoryContext": { "type": "object" },
        "dreamWeatherContext": { "type": "object" },
        "sessionCovenant": { "type": "object" },
        "passageContext": { "type": "object" }
      },
      "additionalProperties": false
    }
  },
  "$defs": {
    "dreamJourneyContext": {
      "type": "object",
      "required": [
        "schema",
        "schemaVersion",
        "symbolTrail",
        "suppressedModuleIds",
        "replacementRoutes",
        "fallbackUsed"
      ],
      "properties": {
        "schema": { "const": "DreamJourneyContextV1" },
        "schemaVersion": { "const": 1 },
        "symbolTrail": { "type": "array", "items": { "type": "string", "minLength": 1 } },
        "suppressedModuleIds": { "type": "array", "items": { "type": "string", "minLength": 1 } },
        "replacementRoutes": {
          "type": "array",
          "items": { "$ref": "#/$defs/dreamJourneyReplacementRoute" }
        },
        "fallbackUsed": { "type": "boolean" }
      },
      "additionalProperties": false
    },
    "dreamJourneyReplacementRoute": {
      "type": "object",
      "required": ["blockedId", "selectedId", "carriedTags", "suppressedTags", "reason"],
      "properties": {
        "blockedId": { "type": "string", "minLength": 1 },
        "selectedId": { "type": "string", "minLength": 1 },
        "carriedTags": { "type": "array", "items": { "type": "string", "minLength": 1 } },
        "suppressedTags": { "type": "array", "items": { "type": "string", "minLength": 1 } },
        "reason": { "type": "string", "minLength": 1 }
      },
      "additionalProperties": false
    }
  },
  "additionalProperties": false
}
